{
  "authority": {
    "evidence_promotion": "prohibited",
    "model_calls": "none",
    "network": "none",
    "physical_execution": "prohibited",
    "source_policy": "unchanged"
  },
  "before_after": [
    {
      "action_linked_source_ids": [
        "CR-2643c3b4a505",
        "CR-37a9ec3de43c",
        "CR-5ac260fabe3e",
        "CR-7914d8186134",
        "CR-79de8a0d42f3",
        "CR-e3690fd04cea",
        "CR-f0b6f99d9ba2",
        "CR-f6d7fcfb6390",
        "OA-W4403767876",
        "OA-W4407799109",
        "OA-W4411285286",
        "OA-W7124232142",
        "OA-W7125541133",
        "OA-W7127140486",
        "OA-W7133186311",
        "OA-W7133940582",
        "OA-W7143470480",
        "OA-W7155172961",
        "OA-W7164023905"
      ],
      "after_candidate_ledger_source_ids": [
        "CR-2643c3b4a505",
        "CR-37a9ec3de43c",
        "CR-5ac260fabe3e",
        "CR-7914d8186134",
        "CR-79de8a0d42f3",
        "CR-e3690fd04cea",
        "CR-f0b6f99d9ba2",
        "CR-f6d7fcfb6390",
        "OA-W4403767876",
        "OA-W4407799109",
        "OA-W4411285286",
        "OA-W7124232142",
        "OA-W7125541133",
        "OA-W7127140486",
        "OA-W7133186311",
        "OA-W7133940582",
        "OA-W7143470480",
        "OA-W7155172961",
        "OA-W7164023905"
      ],
      "arm": "A1",
      "before_final_portfolio_source_ids": [
        "CR-e3690fd04cea",
        "OA-W4403767876"
      ],
      "bus_checkpoint_digest": "eccf814c5880d0722560963290e4734b381eb764cc880d58012acb47adb6f5b8",
      "case_id": "S-ACTIVE-ACCESS",
      "checkpoint_source_candidate_count": 19,
      "diagnostics": [
        "historical_run_predates_viewpoint_support_contract",
        "historical records are retained but not retroactively assigned to invented support tasks"
      ],
      "historical_unassigned": [
        {
          "action_ids": [
            "df0fffa0204cd620",
            "f7c3d005fe14a772"
          ],
          "diagnostics": [
            "historical_run_predates_viewpoint_support_contract"
          ],
          "join_status": "HISTORICAL_UNASSIGNED",
          "source_candidate_id": "CR-2643c3b4a505",
          "support_task_id": null,
          "viewpoint_ids": [
            "LEGACY:single_investigator"
          ]
        },
        {
          "action_ids": [
            "f7c3d005fe14a772"
          ],
          "diagnostics": [
            "historical_run_predates_viewpoint_support_contract"
          ],
          "join_status": "HISTORICAL_UNASSIGNED",
          "source_candidate_id": "CR-37a9ec3de43c",
          "support_task_id": null,
          "viewpoint_ids": [
            "LEGACY:single_investigator"
          ]
        },
        {
          "action_ids": [
            "df0fffa0204cd620",
            "f7c3d005fe14a772"
          ],
          "diagnostics": [
            "historical_run_predates_viewpoint_support_contract"
          ],
          "join_status": "HISTORICAL_UNASSIGNED",
          "source_candidate_id": "CR-5ac260fabe3e",
          "support_task_id": null,
          "viewpoint_ids": [
            "LEGACY:single_investigator"
          ]
        },
        {
          "action_ids": [
            "df0fffa0204cd620"
          ],
          "diagnostics": [
            "historical_run_predates_viewpoint_support_contract"
          ],
          "join_status": "HISTORICAL_UNASSIGNED",
          "source_candidate_id": "CR-7914d8186134",
          "support_task_id": null,
          "viewpoint_ids": [
            "LEGACY:single_investigator"
          ]
        },
        {
          "action_ids": [
            "f7c3d005fe14a772"
          ],
          "diagnostics": [
            "historical_run_predates_viewpoint_support_contract"
          ],
          "join_status": "HISTORICAL_UNASSIGNED",
          "source_candidate_id": "CR-79de8a0d42f3",
          "support_task_id": null,
          "viewpoint_ids": [
            "LEGACY:single_investigator"
          ]
        },
        {
          "action_ids": [
            "df0fffa0204cd620"
          ],
          "diagnostics": [
            "historical_run_predates_viewpoint_support_contract"
          ],
          "join_status": "HISTORICAL_UNASSIGNED",
          "source_candidate_id": "CR-e3690fd04cea",
          "support_task_id": null,
          "viewpoint_ids": [
            "LEGACY:single_investigator"
          ]
        },
        {
          "action_ids": [
            "df0fffa0204cd620"
          ],
          "diagnostics": [
            "historical_run_predates_viewpoint_support_contract"
          ],
          "join_status": "HISTORICAL_UNASSIGNED",
          "source_candidate_id": "CR-f0b6f99d9ba2",
          "support_task_id": null,
          "viewpoint_ids": [
            "LEGACY:single_investigator"
          ]
        },
        {
          "action_ids": [
            "f7c3d005fe14a772"
          ],
          "diagnostics": [
            "historical_run_predates_viewpoint_support_contract"
          ],
          "join_status": "HISTORICAL_UNASSIGNED",
          "source_candidate_id": "CR-f6d7fcfb6390",
          "support_task_id": null,
          "viewpoint_ids": [
            "LEGACY:single_investigator"
          ]
        },
        {
          "action_ids": [
            "c2d0c278dfe5d99f",
            "d77f109ed3bd3124"
          ],
          "diagnostics": [
            "historical_run_predates_viewpoint_support_contract"
          ],
          "join_status": "HISTORICAL_UNASSIGNED",
          "source_candidate_id": "OA-W4403767876",
          "support_task_id": null,
          "viewpoint_ids": [
            "LEGACY:single_investigator"
          ]
        },
        {
          "action_ids": [
            "0dc227391727cd30"
          ],
          "diagnostics": [
            "historical_run_predates_viewpoint_support_contract"
          ],
          "join_status": "HISTORICAL_UNASSIGNED",
          "source_candidate_id": "OA-W4407799109",
          "support_task_id": null,
          "viewpoint_ids": [
            "LEGACY:single_investigator"
          ]
        },
        {
          "action_ids": [
            "c2d0c278dfe5d99f",
            "d77f109ed3bd3124"
          ],
          "diagnostics": [
            "historical_run_predates_viewpoint_support_contract"
          ],
          "join_status": "HISTORICAL_UNASSIGNED",
          "source_candidate_id": "OA-W4411285286",
          "support_task_id": null,
          "viewpoint_ids": [
            "LEGACY:single_investigator"
          ]
        },
        {
          "action_ids": [
            "0dc227391727cd30"
          ],
          "diagnostics": [
            "historical_run_predates_viewpoint_support_contract"
          ],
          "join_status": "HISTORICAL_UNASSIGNED",
          "source_candidate_id": "OA-W7124232142",
          "support_task_id": null,
          "viewpoint_ids": [
            "LEGACY:single_investigator"
          ]
        },
        {
          "action_ids": [
            "c2d0c278dfe5d99f",
            "d77f109ed3bd3124"
          ],
          "diagnostics": [
            "historical_run_predates_viewpoint_support_contract"
          ],
          "join_status": "HISTORICAL_UNASSIGNED",
          "source_candidate_id": "OA-W7125541133",
          "support_task_id": null,
          "viewpoint_ids": [
            "LEGACY:single_investigator"
          ]
        },
        {
          "action_ids": [
            "c2d0c278dfe5d99f",
            "d77f109ed3bd3124"
          ],
          "diagnostics": [
            "historical_run_predates_viewpoint_support_contract"
          ],
          "join_status": "HISTORICAL_UNASSIGNED",
          "source_candidate_id": "OA-W7127140486",
          "support_task_id": null,
          "viewpoint_ids": [
            "LEGACY:single_investigator"
          ]
        },
        {
          "action_ids": [
            "c2d0c278dfe5d99f",
            "d77f109ed3bd3124"
          ],
          "diagnostics": [
            "historical_run_predates_viewpoint_support_contract"
          ],
          "join_status": "HISTORICAL_UNASSIGNED",
          "source_candidate_id": "OA-W7133186311",
          "support_task_id": null,
          "viewpoint_ids": [
            "LEGACY:single_investigator"
          ]
        },
        {
          "action_ids": [
            "50f25b41366b7f92"
          ],
          "diagnostics": [
            "historical_run_predates_viewpoint_support_contract"
          ],
          "join_status": "HISTORICAL_UNASSIGNED",
          "source_candidate_id": "OA-W7133940582",
          "support_task_id": null,
          "viewpoint_ids": [
            "LEGACY:single_investigator"
          ]
        },
        {
          "action_ids": [
            "0dc227391727cd30"
          ],
          "diagnostics": [
            "historical_run_predates_viewpoint_support_contract"
          ],
          "join_status": "HISTORICAL_UNASSIGNED",
          "source_candidate_id": "OA-W7143470480",
          "support_task_id": null,
          "viewpoint_ids": [
            "LEGACY:single_investigator"
          ]
        },
        {
          "action_ids": [
            "0dc227391727cd30"
          ],
          "diagnostics": [
            "historical_run_predates_viewpoint_support_contract"
          ],
          "join_status": "HISTORICAL_UNASSIGNED",
          "source_candidate_id": "OA-W7155172961",
          "support_task_id": null,
          "viewpoint_ids": [
            "LEGACY:single_investigator"
          ]
        },
        {
          "action_ids": [
            "0dc227391727cd30"
          ],
          "diagnostics": [
            "historical_run_predates_viewpoint_support_contract"
          ],
          "join_status": "HISTORICAL_UNASSIGNED",
          "source_candidate_id": "OA-W7164023905",
          "support_task_id": null,
          "viewpoint_ids": [
            "LEGACY:single_investigator"
          ]
        }
      ],